{
  "scene_key": "MARKOV_TWO_STATE_DEMO",
  "scene_version": 1,
  "objects": [
    {"id": "title", "type": "TITLE_TEXT", "label": "A two-state Markov chain"},
    {"id": "nodeA", "type": "STATE_NODE", "label": "Sunny", "x": -3.5, "y": -0.5},
    {"id": "nodeB", "type": "STATE_NODE", "label": "Rainy", "x": 3.5, "y": -0.5},
    {"id": "eq1", "type": "EQUATION", "latex": "P(\\text{Rainy} \\mid \\text{Sunny}) = 0.3", "x": 0, "y": -2.5},
    {"id": "eq2", "type": "EQUATION", "latex": "P(\\text{Sunny} \\mid \\text{Sunny}) = 0.7", "x": 0, "y": -2.5},
    {"id": "trans_matrix", "type": "MATRIX", "rows": [["0.7", "0.3"], ["0.4", "0.6"]], "x": 0, "y": 2.2}
  ],
  "timeline": [
    {"at_ms": 0, "action": "SHOW", "targets": ["title"]},
    {"at_ms": 500, "action": "SHOW", "targets": ["nodeA", "nodeB"]},
    {"at_ms": 1500, "action": "DRAW_TRANSITION", "from": "nodeA", "to": "nodeB", "label": "0.3", "narration_segment_id": "seg1"},
    {"at_ms": 2500, "action": "WRITE", "targets": ["eq1"]},
    {"at_ms": 3500, "action": "HIGHLIGHT", "targets": ["nodeA"]},
    {"at_ms": 4500, "action": "EQUATION_MORPH", "from": "eq1", "to": "eq2"},
    {"at_ms": 5500, "action": "WRITE", "targets": ["trans_matrix"]},
    {"at_ms": 6500, "action": "WAIT", "duration_ms": 500},
    {"at_ms": 7000, "action": "HIDE", "targets": ["title"]}
  ]
}
